SongType,Lyrics
Desire,"Yeah, I'll tell you what I want, what I really, really want So tell me what you want, what you really, really want I'll tell you what I want, what I really, really want So tell me what you want, what you really, really want I wanna, I wanna, I wanna, I wanna I really, really, really wanna zigazig ah I wanna, I wanna, I wanna I really, really, really wanna zigazig ah If you want my future, forget my past If you wanna get with me, better make it fast Now don't go wasting my precious time Get your act together we could be just fine If you wanna be my lover, you gotta get with my friends Make it last forever, friendship never ends If you wanna be my lover, you have got to give Taking is too easy, but that's the way it is Yeah, I'll tell you what I want, what I really, really want So tell me what you want, what you really, really want I wanna, I wanna, I wanna, I wanna I really, really, really wanna zigazig ah What do you think about that, now you know how I feel Say, you can handle my love, are you for real I won't be hasty, I'll give you a try If you really bug me then I'll say goodbye If you wanna be my lover, you gotta get with my friends Make it last forever, friendship never ends If you wanna be my lover, you have got to give Taking is too easy, but that's the way it is Yeah, I'll tell you what I want, what I really, really want So tell me what you want, what you really, really want I wanna, I wanna, I wanna, I wanna I really, really, really wanna zigazig ah So, here's a story from A to Z You wanna get with me, you gotta listen carefully We got Em in the place who likes it in your face You got G like MC who likes it on a Easy V doesn't come for free, she's a real lady And as for me, ah you'll see Slam your body down and wind it all around Slam your body down and wind it all around If you wanna be my lover, you gotta get with my friends Make it last forever, friendship never ends Yeah, I'll tell you what I want, what I really, really want So tell me what you want, what you really, really want I wanna, I wanna, I wanna, I wanna I really, really, really wanna zigazig ah Yeah, I'll tell you what I want, what I really, really want So tell me what you want, what you really, really want I wanna, I wanna, I wanna, I wanna I really, really, really wanna zigazig ah Slam your body down and wind it all around (I really, really, really wanna zigazig ah) Slam your body down and wind it all around (I really, really, really wanna zigazig ah)"
Love,"When all the tears are rolling down your face And it feels like yours was the only heart to break When you come back home and all the lights are out, ooh And you getting used to no one else being around Oh, oh, I'll be there When you need a little love, I got a little love to share Yeah, I'm gonna, I'm gonna, I'm gonna come through You'll never be alone, I'll be there for you I'll be there, I'll be there for you I'll be there, I'll be there for you Oh, I swear, I got enough love for two, ooh, ooh, ooh You'll never be alone, I'll be there for you When it's Friday night and the drink don't work the same You're alone with yourself and there's no one else to blame When you still can't feel the rhythm of your heart And you see your spirit fading in the dark Oh, oh, I'll be there When you need a little love, I got a little love to share Yeah, I'm gonna, I'm gonna, I'm gonna come through You'll never be alone, I'll be there for you I'll be there, I'll be there for you I'll be there, I'll be there for you Oh, I swear, I got enough love for two, ooh, ooh, ooh You'll never be alone, I'll be there for you When you're lost down the river bed, I'll be there When you're lost in the darkness, I'll be there I'll be there when you're heart is breaking You'll never be alone, I'll be there for you I'll be there I'll be there, I'll be there for you (I'll be there) I'll be there, I'll be there for you (ooh, ooh, I'll be there) Oh, I swear, I got enough love for two, ooh, ooh, ooh You'll never be alone, I'll be there for you, oh I'll be there, I'll be there for you (I'll be there when your tears are falling) I'll be there, I'll be there for you (I'll be there, can't you hear me calling?) Oh, I swear, I got enough love for two, ooh, ooh, ooh (I'll be there when you're heart is breaking) You'll never be alone, I'll be there for you, ooh I'll be there for you, ooh I'll be there for you, ooh You'll never be alone, I'll be there for you I'll be there for you, ooh I'll be there for you, ooh You'll never be alone, I'll be there for you"
Love,"From ""Blue Hawaii"" ladies and gentleman Wise men say Only fools, only fools rush in Oh, but I, but I, I can't help falling in love with you Shall I stay? Would it be, would it be a sin? If I can't help falling in love with you Like a river flows Surely to the sea Darling, so it goes Some things, you know, are meant to be Take my hand Take my whole life too For I can""t help falling in love with you For I can""t help falling in love with you Yeah"
Love,"It's a little bit funny Lord, this feeling inside I'm not one of those who can easily hide I don't have much money but boy, if I did I'd buy a big mansion where we both could live If, if, if I was a sculpture Lord, honey but then again, no (Then again no, no) Or a man who makes potions in a travelin' show I know it's not much, I know it's not much but it's the best I can do You gave me a gift, Lord and I'm gonna sing it for you And you can tell everybody that this is your song (This is your song) It may be a quite, quite simple but that's how it's done I hope you don't mind, I hope you don't mind What I wrote down in words, words How wonderful life is when you're in the world, world, world If, if, if I was on a rooftop, I'd kick off my shoes (If, kick off my shoes, kick my shoes off) I'll write a few verses and then I get the blues But the sun's been quite, quite kind while I wrote this song It's for people like you and people like me, I wanna I wanna keep it turnin' on So excuse me for forgetting but these things I do, Lord (These things I do, Lord) You see, you see I've forgotten if they're green or blue Anyway the thing is, anyway the thing is what I really mean You've got the sweetest eyes, you've got the sweetest eyes The clearest eyes I've ever seen, I hope you got back I hope you, I hope you got back and tell everybody that this is your song (This is your song) It may be a quite, quite simple but now that's how it's done I hope you don't mind, I hope you don't mind but I wrote down in words Lord, words, I'm doin' it for how wonderful it is When you're in the world, world, world, world If, if, if I sat upon a rooftop, I'd kick off my shoes (If, kick off my shoes, kick my shoes off) I'll write a few verses and then I get the blues But the sun's been a quite, quite kind while I wrote this song It's for people like you, people like me I wanna, wanna keep it turnin' on, so excuse me, so excuse me So excuse me for forgetting but these things I do, Lord (These things I do, Lord) You see, you see I've forgotten if they're green or blue, baby Anyway the thing is, anyway the thing is what I really mean You've got the sweetest eyes, the sweetest eyes The sweetest eyes I've ever seen, I want you to go back Go back and and tell everybody that Billy Paul's got a song (Billy Paul's got a song) I'm, I'm gonna sit upon a, a rooftop and kick off my shoes I'm gonna write it, write it, write it (Write it, write it, write it) I might come out with the gospel, the blues, the jazz, the rock and roll (Gospel, blues, jazz) I'm gonna, got to, got to write me a simple song for everybody Because this is my song (This is my song) It may be a quite, quite simple but that's the way it's done I hope you don't mind, I hope you don't mind what I wrote down in words Words, you come back, you try to try again, try again Tell everybody that Billy Paul's got a song (Billy Paul's got a song) It may be a quite, quite simple but that's how it's done, baby I hope you don't mind, I hope you don't mind what I wrote down in words Hold it, hold it, hold it, hold it, get back, get, got, oh no"
Love,"If I should stay I would only be in your way So I'll go but I know I'll think of you every step of the way And I will always love you I will always love you You My darling, you Mmm-mm Bittersweet memories – That is all I'm taking with me So good-bye Please don't cry: We both know I'm not what you, you need And I... will always love you I... will always love you You, ooh I hope life treats you kind And I hope you have all you've dreamed of And I'm wishing you joy and happiness But above all this, I wish you love And I... will always love you I will always love you I will always love you I will always love you I will always love you I, I will always love you You Darling, I love you I'll always I'll always love you Ooh Ooh"
Love,"What would I do without your smart mouth? Drawing me in, and you kicking me out You've got my head spinning, no kidding, I can't pin you down What's going on in that beautiful mind? I'm on your magical mystery ride And I'm so dizzy, don't know what hit me, but I'll be alright My head's under water But I'm breathing fine You're crazy and I'm out of my mind 'Cause all of me Loves all of you Love your curves and all your edges All your perfect imperfections Give your all to me I'll give my all to you You're my end and my beginning Even when I lose, I'm winning 'Cause I give you all of me And you give me all of you, oh-oh How many times do I have to tell you? Even when you're crying, you're beautiful too The world is beating you down, I'm around through every mood You're my downfall, you're my muse My worst distraction, my rhythm and blues I can't stop singing, it's ringing in my head for you My head's under water But I'm breathing fine You're crazy and I'm out of my mind 'Cause all of me Loves all of you Love your curves and all your edges All your perfect imperfections Give your all to me I'll give my all to you You're my end and my beginning Even when I lose, I'm winning 'Cause I give you all of me And you give me all of you, oh-oh Give me all of you, oh Cards on the table, we're both showing hearts Risking it all, though it's hard 'Cause all of me Loves all of you Love your curves and all your edges All your perfect imperfections Give your all to me I'll give my all to you You're my end and my beginning Even when I lose, I'm winning 'Cause I give you all of me And you give me all of you I give you all of me And you give me all of you, oh-oh"
Love,"You think I'm pretty without any makeup on You think I'm funny when I tell the punch line wrong I know you get me, so I let my walls come down, down Before you met me I was alright, but things were kinda heavy You brought me to life, now every February You'll be my Valentine, Valentine Let's go all the way tonight No regrets, just love We can dance, until we die You and I, will be young forever You make me Feel like I'm livin' a teenage dream The way you turn me on, I can't sleep Let's run away and don't ever look back, don't ever look back My heart stops When you look at me, just one touch Now, baby, I believe this is real So take a chance and don't ever look back, don't ever look back We drove to Cali and got drunk on the beach Got a motel and built a fort out of sheets I finally found you, my missing puzzle piece I'm complete Let's go all the way tonight No regrets, just love We can dance until we die You and I, will be young forever You make me Feel like I'm livin' a teenage dream The way you turn me on, I can't sleep Let's run away and don't ever look back, don't ever look back My heart stops When you look at me, just one touch Now baby I believe this is real So take a chance and don't ever look back, don't ever look back I'ma get your heart racing in my skin-tight jeans Be your teenage dream tonight Let you put your hands on me in my skin-tight jeans Be your teenage dream tonight (Tonight, tonight, tonight, tonight, tonight, tonight) You make me Feel like I'm livin' a teenage dream The way you turn me on, I can't sleep Let's run away and don't ever look back, don't ever look back (no) My heart stops When you look at me, just one touch Now, baby, I believe this is real (oh) So take a chance and don't ever look back, don't ever look back I'ma get your heart racing in my skin-tight jeans Be your teenage dream tonight Let you put your hands on me in my skin-tight jeans Be your teenage dream tonight (Tonight, tonight, tonight, tonight, tonight, tonight)"
Love,"Do you ever feel like a plastic bag Drifting through the wind, wanting to start again? Do you ever feel, feel so paper thin Like a house of cards, one blow from cavin' in? Do you ever feel already buried deep? Six feet under screams, but no one seems to hear a thing Do you know that there's still a chance for you? 'Cause there's a spark in you You just gotta ignite the light And let it shine Just own the night Like the Fourth of July 'Cause baby, you're a firework Come on, show 'em what you're worth Make 'em go, ""Oh, oh, oh"" As you shoot across the sky Baby, you're a firework Come on, let your colors burst Make 'em go, ""Oh, oh, oh"" You're gonna leave 'em all in awe, awe, awe You don't have to feel like a waste of space You're original, cannot be replaced If you only knew what the future holds After a hurricane comes a rainbow Maybe a reason why all the doors are closed So you could open one that leads you to the perfect road Like a lightning bolt, your heart will glow And when it's time, you'll know You just gotta ignite the light And let it shine Just own the night Like the Fourth of July 'Cause baby, you're a firework Come on, show 'em what you're worth Make 'em go, ""Oh, oh, oh"" As you shoot across the sky Baby, you're a firework Come on, let your colors burst Make 'em go, ""Oh, oh, oh"" You're gonna leave 'em all in awe, awe, awe Boom, boom, boom Even brighter than the moon, moon, moon It's always been inside of you, you, you And now it's time to let it through 'Cause baby, you're a firework Come on, show 'em what you're worth Make 'em go, ""Oh, oh, oh"" As you shoot across the sky Baby, you're a firework Come on, let your colors burst Make 'em go, ""Oh, oh, oh"" You're gonna leave 'em all in awe, awe, awe Boom, boom, boom Even brighter than the moon, moon, moon Boom, boom, boom Even brighter than the moon, moon, moon"
Love,"Yeah, you could be the greatest, you can be the best You can be the King Kong banging on your chest You could beat the world, you could beat the war You could talk to God, go banging on his door You can throw your hands up, you can beat the clock (yeah) You can move a mountain, you can break rocks You could be a master, don't wait for luck Dedicate yourself and you gon' find yourself Standing in the hall of fame (yeah) And the world's gonna know your name (yeah) 'Cause you burn with the brightest flame (yeah) And the world's gonna know your name (yeah) And you'll be on the walls of the hall of fame You can go the distance, you can run the mile You can walk straight through hell with a smile You could be a hero, you could get the gold Breaking all the records they thought never could be broke Yeah, do it for your people, do it for your pride How you ever gonna know if you never even try? Do it for your country, do it for your name 'Cause there's gonna be a day when you're Standing in the hall of fame (yeah) And the world's gonna know your name (yeah) 'Cause you burn with the brightest flame (yeah) And the world's gonna know your name (yeah) And you'll be on the walls of the hall of fame Be a champion Be a champion Be a champion Be a champion (you'll be on the walls of the hall of fame) Be students, be teachers Be politicians, be preachers (yeah, yeah) Be believers, be leaders Be astronauts, be champions, be truth-seekers Be students, be teachers Be politicians, be preachers (be preachers, yeah, yeah) Be believers, be leaders Be astronauts, be champions Standing in the hall of fame (yeah, yeah, yeah) And the world's gonna know your name (yeah, yeah, yeah) 'Cause you burn with the brightest flame, oh-whoa (yeah, yeah, yeah) And the world's gonna know your name, oh, yeah (yeah, yeah, yeah) And you'll be on the walls of the hall of fame You could be the greatest, you can be the best (be a champion) You can be the King Kong banging on your chest (be a champion) You could beat the world, you could beat the war (be a champion) You could talk to God, go banging on his door (be a champion) You can throw your hands up, you can beat the clock (be a champion) You can move a mountain, you can break rocks (be a champion) You could be a master, don't wait for luck (be a champion) Dedicate yourself and you gon' find yourself (be a champion) Standing in the hall of fame"
Love,"I used to think that I could not go on And life was nothing but an awful song But now I know the meaning of true love I'm leaning on the everlasting arms If I can see it, then I can do it If I just believe it, there's nothing to it I believe I can fly I believe I can touch the sky I think about it every night and day Spread my wings and fly away I believe I can soar I see me running through that open door I believe I can fly I believe I can fly I believe I can fly (woo) See I was on the verge of breaking down Sometimes silence can seem so loud There are miracles in life I must achieve But first I know it starts inside of me If I can see it, then I can be it If I just believe it, there's nothing to it I believe I can fly I believe I can touch the sky I think about it every night and day Spread wings and fly away I believe I can soar I see me running through that open door I believe I can fly I believe I can fly I believe I can fly (woo!) Hey, 'cause I believe in you Oh If I can see it (woo!), then I can do it (I can do it) If I just believe it, there's nothing to it (hey) I believe I can fly (woo!) I believe I can touch the sky I think about it every night and day Spread my wings and fly away I believe I can soar I see me running through that open door I believe I can fly (I can fly) I believe I can fly (I can fly) I believe I can fly (I can fly) If I just spread my wings (I can fly) I can fly (I can fly) I can fly (I can fly) I can fly (I can fly) If I just spread my wings (I can fly) I can fly (I can fly, I can fly) Woo (I can fly) Hm-mm... fly, fly, fly"
Love,"I can almost see it That dream I'm dreaming But there's a voice inside my head saying You'll never reach it Every step I'm taking Every move I make feels Lost with no direction My faith is shaking But I, I gotta keep trying Gotta keep my head held high There's always gonna be another mountain I'm always gonna wanna make it move Always gonna be an uphill battle Sometimes I'm gonna have to lose Ain't about how fast I get there Ain't about what's waiting on the other side It's the climb The struggles I'm facing The chances I'm taking Sometimes might knock me down, but No, I'm not breaking I may not know it But these are the moments, that I'm gonna remember most, yeah Just gotta keep going And I, I gotta be strong Just keep pushing on, 'cause There's always gonna be another mountain I'm always gonna wanna make it move Always gonna be an uphill battle Sometimes I'm gonna have to lose Ain't about how fast I get there Ain't about what's waiting on the other side It's the climb Yeah There's always gonna be another mountain I'm always gonna wanna make it move Always gonna be an uphill battle Sometimes you're gonna have to lose Ain't about how fast I get there Ain't about what's waiting on the other side It's the climb Yeah, yeah Keep on moving, keep climbing Keep the faith, baby It's all about, it's all about the climb Keep your faith, keep your faith Whoa"
Love,"When the night, has come And the land is dark And the moon, is the only, light we'll see No I won't, be afraid No I won't, be afraid Just as long, as you stand, stand by me So darlin', darlin' stand, by me Oh-oh stand by me Oh stand, stand by me, stand by me If the sky, that we look upon, should tumble and fall Or the mountains, should crumble, to the sea I won't cry, I won't cry, no-no-no I won't shed a tear Just as long, as you stand, by me And darlin', darlin' stand, by me Oh-oh-oh, stand, by me Oh darling, stand by me, stand by me, stand by me Whoa-oh-oh, ay-ay Ma-ma-my, my-ee If the mountains should crumble to the sea Ma-ma-my-my-my When the night, has come And, and the land is dark And the moon, is the only, only light we'll see So darlin', darlin' stand, by me, oh-oh stand by me Oh darling, stand by me, stand by me Whenever you're in trouble won't you stand, by me Oh-oh-oh-oh-oh, stand by me, stand by me, stand by me So darlin', darlin', stand, oh-oh, oo-oo, oh-oh As long as I know I got you right here Right here by my side Come on, come on, stand, stand right here"
Love,"Woah, my love, my darling I've hungered for your touch A long, lonely time And time goes by so slowly And time can do so much Are you still mine? I need your love I need your love God speed your love to me Lonely rivers flow To the sea, to the sea To the open arms of the sea, yeah Lonely rivers sigh ""Wait for me, wait for me"" I'll be coming home, wait for me Woah, my love, my darling I've hungered, hungered for your touch A long, lonely time And time goes by so slowly And time can do so much Are you still mine? I need your love I need your love God speed your love to me"
Coming of Age,"Well, she was an American girl Raised on promises She couldn't help thinkin' that there Was a little more to life Somewhere else After all it was a great big world With lots of places to run to Yeah, and if she had to die tryin' She had one little promise She was gonna keep Oh yeah, alright Take it easy baby Make it last all night She was an American girl Well, it was kind of cold that night She stood alone on her balcony Yeah, she could hear the cars roll by Out on 441 Like waves crashin' on the beach And for one desperate moment there He crept back in her memory God it's so painful Something that's so close And still so far out of reach Oh yeah, alright Take it easy, baby Make it last all night She was an American girl Ooh Uh-huh-huh Uh-huh-huh Oh yeah"
Coming of Age,"An old man turned ninety-eight He won the lottery and died the next day It's a black fly in your Chardonnay It's a death row pardon two minutes too late Isn't it ironic, don't you think? It's like rain on your wedding day It's a free ride when you've already paid It's the good advice that you just didn't take And who would've thought it, it figures Mr. Play-It-Safe was afraid to fly He packed his suitcase and kissed his kids good-bye He waited his whole damn life to take that flight And as the plane crashed down he thought ""Well isn't this nice"" And isn't it ironic, don't you think? It's like rain on your wedding day It's a free ride when you've already paid It's the good advice that you just didn't take And who would've thought it, it figures Well life has a funny way of sneaking up on you When you think everything's okay and everything's going right And life has a funny way of helping you out when You think everything's gone wrong and everything blows up in your face A traffic jam when you're already late A ""No Smoking"" sign on your cigarette break It's like ten thousand spoons when all you need is a knife It's meeting the man of my dreams, and then meeting his beautiful wife And isn't it ironic, don't you think? A little too ironic, and yeah I really do think It's like rain on your wedding day It's a free ride when you've already paid It's the good advice that you just didn't take And who would've thought it, it figures Life has a funny way of sneaking up on you Life has a funny, funny way of helping you out Helping you out"
Coming of Age,"Coming out of my cage And I've been doing just fine Gotta gotta be down Because I want it all It started out with a kiss How did it end up like this? It was only a kiss, it was only a kiss Now I'm falling asleep And she's calling a cab While he's having a smoke And she's taking a drag Now they're going to bed And my stomach is sick And it's all in my head But she's touching his chest now He takes off her dress now Let me go And I just can't look, it's killing me And taking control Jealousy, turning saints into the sea Swimming through sick lullabies Choking on your alibis But it's just the price I pay Destiny is calling me Open up my eager eyes 'Cause I'm Mr. Brightside I'm coming out of my cage And I've been doing just fine Gotta gotta be down Because I want it all It started out with a kiss How did it end up like this? (It was only a kiss), it was only a kiss Now I'm falling asleep And she's calling a cab While he's having a smoke And she's taking a drag Now they're going to bed And my stomach is sick And it's all in my head But she's touching his chest now He takes off her dress now Let me go 'Cause I just can't look, it's killing me And taking control Jealousy, turning saints into the sea Swimming through sick lullabies Choking on your alibi But it's just the price I pay Destiny is calling me Open up my eager eyes 'Cause I'm Mr. Brightside I never I never I never I never"
